{
  "schema_version": 1,
  "run_id": "fixture-autonomy",
  "started_at": "2026-07-24T10:00:00Z",
  "project": {
    "id": "fixture-autonomy",
    "goal": "Prove two local slices before a frozen final-state evaluation."
  },
  "authorization": {
    "allowed_files": ["workflow/**", "tests/**", "scripts/**"],
    "allowed_tools": ["node", "bash"],
    "forbidden_actions": [
      "external_write",
      "push",
      "pull_request",
      "deploy",
      "production",
      "billing",
      "secrets",
      "obvault_write"
    ]
  },
  "budget": {
    "max_iterations": 2,
    "max_duration_minutes": 30,
    "max_candidates": 8
  },
  "checkpoints": [
    {
      "id": "fresh-review",
      "before_slice": "verification",
      "category": "fresh_context_review",
      "target": "fixture-autonomy:verification"
    }
  ],
  "stop_conditions": {
    "same_hypothesis_failures": 2,
    "red_checks_without_diff": 3
  },
  "evaluation": {
    "runner": "scripts/vnext-suite --json --strategy baseline",
    "final_state_grader": "fixture-final-state-grader",
    "held_out_surface": "workflow/vnext/population.json#sealed-held-out",
    "sealed_held_out": true
  },
  "slices": [
    {
      "id": "contract",
      "objective": "Create the bounded contract in owned workflow files.",
      "allowed_files": ["workflow/**"],
      "allowed_tools": ["node", "bash"],
      "verification": {
        "command": "node --check scripts/lib/project-autonomy.mjs",
        "evidence": "controller parses under Node"
      }
    },
    {
      "id": "verification",
      "objective": "Prove the final-state path after independent review authorization.",
      "allowed_files": ["tests/**", "scripts/**"],
      "allowed_tools": ["node", "bash"],
      "checkpoint_id": "fresh-review",
      "verification": {
        "command": "scripts/vnext-suite --json --strategy baseline",
        "evidence": "frozen held-out final-state run"
      }
    }
  ]
}
